qid,label_en,label_fr,description_en,description_fr,instance_of_uuid,instance_of,artist_uuid,artist,artist_series_ordinal,artist_ref1_hash,artist_ref1_reference_url,artist_ref1_retrieved_nodeId,artist_ref1_retrieved_val,artist_ref1_retrieved_prec,height_uuid,height_nodeId,height_val,height_unit,gps_uuid,gps_nodeId,gps_val,gps_long,gps_prec,title_en_uuid,title_en
Q6,Statue of Liberty,La Liberté éclairant le monde,colossal sculpture in New York harbor,monument de la ville de New York,FD4E60B7-F166-47E9-A036-7CF8039AFA73,Q3,67790D58-E327-43F3-AC96-2885853E2F1C,Q1,1,8727faeff82286cd6b2868837d2db63e6f16ba54,https://www.nps.gov/stli/learn/historyculture/people.htm,1c826145-91fc-49c8-9068-ea9e689a7597,2022-02-07T00:00:00Z,11,2838EA6C-6D82-4330-9137-0AE65F25A5FE,b7043533-3599-48d3-add1-4efd88e03bb3,46,Q4,DF1432EB-60E5-4847-A8A0-2F05864EDBF1,ac03132b-db2b-4fd4-acec-0e88b7025aac,40.689167,-74.044444,0.0001,12977A40-F0E1-47A6-8930-63EF5DC76B2D,Liberty Enlightening the World
Q8,Venus de Milo,Vénus de Milo,Ancient Greek marble statue of a woman,sculpture grecque de la fin de l'époque hellénistique,58A9CAD9-F06A-46B4-8274-222447A54CF6,Q3,DC36B268-F837-410E-93D2-607F45433DD7,_:1846801f6aaaa4abb2000797f7d3dc21,,,,,,,D486B6E4-8D47-4DF9-843D-5B24D408A1A2,9f2c91d5-29cc-4f3e-9efc-cda43a85ba05,202,Q12,DEE91BE1-575F-4E05-8CFE-FE8BE007EAA2,8f694aff-d0d0-437f-9e34-b5bc748733c6,48.859944681901,2.3372878730152,0.013654266337667,1B7B8F52-40A7-4BC6-B522-6205EE141883,Venus de Milo (Aphrodite of Milos)
Q9,David,David,sculpture by Michelangelo,statue de Michel-Ange,E9253E8E-8D8C-4401-AF6E-25685C67DD92,Q3,2B6154C6-C5AC-42AF-96BA-B45066553FE3,Q7,,be91ac7fbc90be8621cf01ca24ae00dc43690fdd,https://www.galleriaaccademiafirenze.it/opere/david/,,,,5E0F4EB1-CC85-4C06-A237-B9DC8E25EA53,5ac5ba6f-7a8d-4e04-86af-42c5cde06654,517,Q12,305FF2EC-3226-4267-A05A-D9DEC3A08254,eb96b641-543b-4e25-8dd2-bce7bbabfb84,43.776702777778,11.25945,2.7777777777778E-06,F1CA18A0-DA98-4ADB-AEB7-AE80728BD492,David
Q10,Golden Rhinoceros of Mapungubwe,,medieval artifact made from wood which is covered in thin sheets of gold from the Kingdom of Mapungubwe,,4F3414EE-2D9B-42C6-BB8A-BEF528C54317,Q3,,,,,,,,,,,,,,,,,,,
Q11,Lion Capital of Asoka,Chapiteau aux lions d'Ashoka,"capital of a column of Mauryan emperor Ashoka in Sarnath, Uttar Pradesh, India",emblème national de l'Inde,B5FDCB2D-2040-48F6-936C-9B0A5E75628E,Q3,0B6B8471-870A-49CA-B6C1-E0A7A82E5870,_:2cd1b162bfddbb3d1c905fc36dd145d2,,e6cdf45c9eb4a44d13385e934d57e663e2a49f4d,https://beckchris.wordpress.com/visual-arts/best-works-of-art-of-all-time-the-critics-picks/,,,,,,,,9F9BFD9A-1253-40B1-8A2E-99A8B5BF532F,23f264d3-0422-4e89-92c8-4b2300a2cca0,25.3811,83.0214,0.0001,742FCC25-B792-4FBA-84BF-74752C8C4D2C,Lion Capital of Ashoka
